<?xml version="1.0" encoding="utf-8"?>
<?xml-stylesheet type="text/xsl" href="../../xsl/room.xsl"?>
<!DOCTYPE class-schedule SYSTEM "../../dtd/room.dtd">
<class-schedule type="room" id="{room-id}" name="{room-name}" year="template" semester="">
	<weekday day="1">
		<section section="0">
		</section>
		<section section="1">
			<classes>
				<subject id="stemplate">{s-name}</subject>
				<class id="ctemplate">{c-name}</class>
				<teacher id="ttemplate">{t-name}</teacher>
			</classes>
		</section>
		<section section="2">
			<classes>
				<subject id="stemplate">{s-name}</subject>
				<class id="ctemplate">{c-name}</class>
				<teacher id="ttemplate">{t-name}</teacher>
			</classes>
		</section>
		<section section="3">
			<classes>
				<subject id="stemplate">{s-name}</subject>
				<class id="ctemplate">{c-name}</class>
				<teacher id="ttemplate">{t-name}</teacher>
			</classes>
		</section>
		<section section="4">
			<classes>
				<subject id="stemplate">{s-name}</subject>
				<class id="ctemplate">{c-name}</class>
				<teacher id="ttemplate">{t-name}</teacher>
			</classes>
		</section>
		<section section="5">
			<classes>
				<subject id="stemplate">{s-name}</subject>
				<class id="ctemplate">{c-name}</class>
				<teacher id="ttemplate">{t-name}</teacher>
			</classes>
		</section>
		<section section="6">
			<classes>
				<subject id="stemplate">{s-name}</subject>
				<class id="ctemplate">{c-name}</class>
				<teacher id="ttemplate">{t-name}</teacher>
			</classes>
		</section>
		<section section="7">
			<classes>
				<subject id="stemplate">{s-name}</subject>
				<class id="ctemplate">{c-name}</class>
				<teacher id="ttemplate">{t-name}</teacher>
			</classes>
		</section>
		<section section="8">
			<classes>
				<subject id="stemplate">{s-name}</subject>
				<class id="ctemplate">{c-name}</class>
				<teacher id="ttemplate">{t-name}</teacher>
			</classes>
		</section>
		<section section="9">
		</section>
	</weekday>
	<weekday day="2">
		<section section="0">
		</section>
		<section section="1">
			<classes>
				<subject id="stemplate">{s-name}</subject>
				<class id="ctemplate">{c-name}</class>
				<teacher id="ttemplate">{t-name}</teacher>
			</classes>
		</section>
		<section section="2">
			<classes>
				<subject id="stemplate">{s-name}</subject>
				<class id="ctemplate">{c-name}</class>
				<teacher id="ttemplate">{t-name}</teacher>
			</classes>
		</section>
		<section section="3">
			<classes>
				<subject id="stemplate">{s-name}</subject>
				<class id="ctemplate">{c-name}</class>
				<teacher id="ttemplate">{t-name}</teacher>
			</classes>
		</section>
		<section section="4">
			<classes>
				<subject id="stemplate">{s-name}</subject>
				<class id="ctemplate">{c-name}</class>
				<teacher id="ttemplate">{t-name}</teacher>
			</classes>
		</section>
		<section section="5">
			<classes>
				<subject id="stemplate">{s-name}</subject>
				<class id="ctemplate">{c-name}</class>
				<teacher id="ttemplate">{t-name}</teacher>
			</classes>
		</section>
		<section section="6">
			<classes>
				<subject id="stemplate">{s-name}</subject>
				<class id="ctemplate">{c-name}</class>
				<teacher id="ttemplate">{t-name}</teacher>
			</classes>
		</section>
		<section section="7">
			<classes>
				<subject id="stemplate">{s-name}</subject>
				<class id="ctemplate">{c-name}</class>
				<teacher id="ttemplate">{t-name}</teacher>
			</classes>
		</section>
		<section section="8">
			<classes>
				<subject id="stemplate">{s-name}</subject>
				<class id="ctemplate">{c-name}</class>
				<teacher id="ttemplate">{t-name}</teacher>
			</classes>
		</section>
		<section section="9">
		</section>
	</weekday>
	<weekday day="3">
		<section section="0">
		</section>
		<section section="1">
			<classes>
				<subject id="stemplate">{s-name}</subject>
				<class id="ctemplate">{c-name}</class>
				<teacher id="ttemplate">{t-name}</teacher>
			</classes>
		</section>
		<section section="2">
			<classes>
				<subject id="stemplate">{s-name}</subject>
				<class id="ctemplate">{c-name}</class>
				<teacher id="ttemplate">{t-name}</teacher>
			</classes>
		</section>
		<section section="3">
			<classes>
				<subject id="stemplate">{s-name}</subject>
				<class id="ctemplate">{c-name}</class>
				<teacher id="ttemplate">{t-name}</teacher>
			</classes>
		</section>
		<section section="4">
			<classes>
				<subject id="stemplate">{s-name}</subject>
				<class id="ctemplate">{c-name}</class>
				<teacher id="ttemplate">{t-name}</teacher>
			</classes>
		</section>
		<section section="5">
			<classes>
				<subject id="stemplate">{s-name}</subject>
				<class id="ctemplate">{c-name}</class>
				<teacher id="ttemplate">{t-name}</teacher>
			</classes>
		</section>
		<section section="6">
			<classes>
				<subject id="stemplate">{s-name}</subject>
				<class id="ctemplate">{c-name}</class>
				<teacher id="ttemplate">{t-name}</teacher>
			</classes>
		</section>
		<section section="7">
			<classes>
				<subject id="stemplate">{s-name}</subject>
				<class id="ctemplate">{c-name}</class>
				<teacher id="ttemplate">{t-name}</teacher>
			</classes>
		</section>
		<section section="8">
			<classes>
				<subject id="stemplate">{s-name}</subject>
				<class id="ctemplate">{c-name}</class>
				<teacher id="ttemplate">{t-name}</teacher>
			</classes>
		</section>
		<section section="9">
		</section>
	</weekday>
	<weekday day="4">
		<section section="0">
		</section>
		<section section="1">
			<classes>
				<subject id="stemplate">{s-name}</subject>
				<class id="ctemplate">{c-name}</class>
				<teacher id="ttemplate">{t-name}</teacher>
			</classes>
		</section>
		<section section="2">
			<classes>
				<subject id="stemplate">{s-name}</subject>
				<class id="ctemplate">{c-name}</class>
				<teacher id="ttemplate">{t-name}</teacher>
			</classes>
		</section>
		<section section="3">
			<classes>
				<subject id="stemplate">{s-name}</subject>
				<class id="ctemplate">{c-name}</class>
				<teacher id="ttemplate">{t-name}</teacher>
			</classes>
		</section>
		<section section="4">
			<classes>
				<subject id="stemplate">{s-name}</subject>
				<class id="ctemplate">{c-name}</class>
				<teacher id="ttemplate">{t-name}</teacher>
			</classes>
		</section>
		<section section="5">
			<classes>
				<subject id="stemplate">{s-name}</subject>
				<class id="ctemplate">{c-name}</class>
				<teacher id="ttemplate">{t-name}</teacher>
			</classes>
		</section>
		<section section="6">
			<classes>
				<subject id="stemplate">{s-name}</subject>
				<class id="ctemplate">{c-name}</class>
				<teacher id="ttemplate">{t-name}</teacher>
			</classes>
		</section>
		<section section="7">
			<classes>
				<subject id="stemplate">{s-name}</subject>
				<class id="ctemplate">{c-name}</class>
				<teacher id="ttemplate">{t-name}</teacher>
			</classes>
		</section>
		<section section="8">
			<classes>
				<subject id="stemplate">{s-name}</subject>
				<class id="ctemplate">{c-name}</class>
				<teacher id="ttemplate">{t-name}</teacher>
			</classes>
		</section>
		<section section="9">
		</section>
	</weekday>
	<weekday day="5">
		<section section="0">
		</section>
		<section section="1">
			<classes>
				<subject id="stemplate">{s-name}</subject>
				<class id="ctemplate">{c-name}</class>
				<teacher id="ttemplate">{t-name}</teacher>
			</classes>
		</section>
		<section section="2">
			<classes>
				<subject id="stemplate">{s-name}</subject>
				<class id="ctemplate">{c-name}</class>
				<teacher id="ttemplate">{t-name}</teacher>
			</classes>
		</section>
		<section section="3">
			<classes>
				<subject id="stemplate">{s-name}</subject>
				<class id="ctemplate">{c-name}</class>
				<teacher id="ttemplate">{t-name}</teacher>
			</classes>
		</section>
		<section section="4">
			<classes>
				<subject id="stemplate">{s-name}</subject>
				<class id="ctemplate">{c-name}</class>
				<teacher id="ttemplate">{t-name}</teacher>
			</classes>
		</section>
		<section section="5">
			<classes>
				<subject id="stemplate">{s-name}</subject>
				<class id="ctemplate">{c-name}</class>
				<teacher id="ttemplate">{t-name}</teacher>
			</classes>
		</section>
		<section section="6">
			<classes>
				<subject id="stemplate">{s-name}</subject>
				<class id="ctemplate">{c-name}</class>
				<teacher id="ttemplate">{t-name}</teacher>
			</classes>
		</section>
		<section section="7">
			<classes>
				<subject id="stemplate">{s-name}</subject>
				<class id="ctemplate">{c-name}</class>
				<teacher id="ttemplate">{t-name}</teacher>
			</classes>
		</section>
		<section section="8">
			<classes>
				<subject id="stemplate">{s-name}</subject>
				<class id="ctemplate">{c-name}</class>
				<teacher id="ttemplate">{t-name}</teacher>
			</classes>
		</section>
		<section section="9">
		</section>
	</weekday>
	<weekday day="6">
		<section section="0">
		</section>
		<section section="1">
		</section>
		<section section="2">
		</section>
		<section section="3">
		</section>
		<section section="4">
		</section>
		<section section="5">
		</section>
		<section section="6">
		</section>
		<section section="7">
		</section>
		<section section="8">
		</section>
		<section section="9">
		</section>
	</weekday>
</class-schedule>